text,category,source,cleaned_text
"In a separate but related development, Osondu Onyekwere, respected former councillor and PDP leader from Itumbauzor, also announced his switch to the APC.",Politics & Power,https://thesun.ng/abia-pdp-leaders-defect-to-apc-cite-kalus-influence/,separate related development osondu onyekwere respected former councillor pdp leader itumbauzor also announced switch apc
“Senator Kalu is rehabilitating two schools in Ntalakwu and has already constructed about 12km of the 60km road connecting Bende to our community. No other Senator from Abia is doing what he’s doing. Leadership is about the value you add—and Senator Kalu has set the bar.”,Politics & Power,https://thesun.ng/abia-pdp-leaders-defect-to-apc-cite-kalus-influence/,senator kalu rehabilitating two schools ntalakwu already constructed 12km 60km road connecting bende community senator abia hes leadership value addand senator kalu set bar
"“It’s not just about the party anymore; it’s about the individual. Anyone who refuses to identify with Orji Uzor Kalu is making a great mistake,” he added.",Politics & Power,https://thesun.ng/abia-pdp-leaders-defect-to-apc-cite-kalus-influence/,party anymore individual anyone refuses identify orji uzor kalu making great mistake added
"The OUK Movement, Abia’s largest grassroots political structure loyal to Senator Kalu, held a strategic joint meeting on May 17 with legislative aides and LGA coordinators to consolidate support for the re-election of both President Tinubu and Senator Kalu.",Politics & Power,https://thesun.ng/abia-pdp-leaders-defect-to-apc-cite-kalus-influence/,ouk movement abias largest grassroots political structure loyal senator kalu held strategic joint meeting may 17 legislative aides lga coordinators consolidate support reelection president tinubu senator kalu
"Chaired by the patron of the movement, Chief Agu Agu Ogwo, and attended by representatives from all 17 LGAs, the meeting emphasised total grassroots mobilisation ahead of the 2027 general elections.",Politics & Power,https://thesun.ng/abia-pdp-leaders-defect-to-apc-cite-kalus-influence/,chaired patron movement chief agu agu ogwo attended representatives 17 lgas meeting emphasised total grassroots mobilisation ahead 2027 general elections
"“The project of reelecting President Bola Ahmed Tinubu and our own Senator Orji Uzor Kalu is not just political; it’s personal,” declared  Sunday Ogbaja Orjisi, state chairman of the OUK Movement.",Politics & Power,https://thesun.ng/abia-pdp-leaders-defect-to-apc-cite-kalus-influence/,project reelecting president bola ahmed tinubu senator orji uzor kalu political personal declared sunday ogbaja orjisi state chairman ouk movement
"“We were the only zone that delivered votes to President Tinubu in 2023 despite the Labour Party wave. We will do it again—and even bigger—in 2027. We passed a serious vote of confidence on our principal Senator Kalu, who has carried the APC on his back in Abia State.”",Politics & Power,https://thesun.ng/abia-pdp-leaders-defect-to-apc-cite-kalus-influence/,zone delivered votes president tinubu 2023 despite labour party wave againand even biggerin 2027 passed serious vote confidence principal senator kalu carried apc back abia state
"The meeting concluded with a unanimous vote of confidence in President Tinubu and Senator Kalu, affirming the unwavering commitment of the OUK Movement and its partners to the victory of the APC in Abia and beyond.",Politics & Power,https://thesun.ng/abia-pdp-leaders-defect-to-apc-cite-kalus-influence/,meeting concluded unanimous vote confidence president tinubu senator kalu affirming unwavering commitment ouk movement partners victory apc abia beyond
"As momentum builds across Abia North, analysts say this realignment signals a major shakeup ahead of the 2027 elections, with Senator Orji Uzor Kalu emerging as the central figure reshaping the region’s political landscape.",Politics & Power,https://thesun.ng/abia-pdp-leaders-defect-to-apc-cite-kalus-influence/,momentum builds across abia north analysts say realignment signals major shakeup ahead 2027 elections senator orji uzor kalu emerging central figure reshaping regions political landscape
"Amidstthe spate of carpet crossings by opposition bigwigs and their followers, an All Progressives Congress, APC bigwig, Chief Sam Nkire, has predicted victory and strength for democracy and the ruling APC in the next general elections.",Politics & Power,https://thesun.ng/defectorll-strengthen-democracy-apc-nkire/,amidstthe spate carpet crossings opposition bigwigs followers progressives congress apc bigwig chief sam nkire predicted victory strength democracy ruling apc next general elections
"Rather than disintegrate and weaken, the APC chieftain said the calibre and quality of opposition converts streaming into his party was “not only amazing but a sign and shape of things to come in the 2027 presidential and other elections.”",Politics & Power,https://thesun.ng/defectorll-strengthen-democracy-apc-nkire/,rather disintegrate weaken apc chieftain said calibre quality opposition converts streaming party amazing sign shape things come 2027 presidential elections
"Chief Nkire added that any patriotic Nigerian would agree that Nigeria’s president, Bola Tinubu was, no doubt, making the right moves towards improving the poor economic and insecurity climate he inherited on assumption of office on May 29, 2023.",Politics & Power,https://thesun.ng/defectorll-strengthen-democracy-apc-nkire/,chief nkire added patriotic nigerian would agree nigerias president bola tinubu doubt making right moves towards improving poor economic insecurity climate inherited assumption office may 29 2023
"The former National Chairman of PPA and a pioneer member of the APC national caucus also assured Nigerians that his party under the leadership of President Tinubu would not fail, with the windfall created by the high quality political influx from opposition parties into the ruling party. He added that unity is strength.",Politics & Power,https://thesun.ng/defectorll-strengthen-democracy-apc-nkire/,former national chairman ppa pioneer member apc national caucus also assured nigerians party leadership president tinubu would fail windfall created high quality political influx opposition parties ruling party added unity strength
"Chief Nkire seized the opportunity to appeal to Nigerian voters to trust Tinubu, who he described as an experienced wealth creator and political visionary, to pilot the country to the promised land.",Politics & Power,https://thesun.ng/defectorll-strengthen-democracy-apc-nkire/,chief nkire seized opportunity appeal nigerian voters trust tinubu described experienced wealth creator political visionary pilot country promised land
"He further appealed to the decampees, returning and remaining members to tolerate and be patient with one another in order to work in unity to achieve the set goals of the APC, which include making life better, as well as protecting lives and property of Nigerians.",Politics & Power,https://thesun.ng/defectorll-strengthen-democracy-apc-nkire/,appealed decampees returning remaining members tolerate patient one another order work unity achieve set goals apc include making life better well protecting lives property nigerians
"In another development, he has thrown his weight behind such opposition party members as the Federal Capital Territory Minister, Nyesom Wike, who he described as a patriot and an asset of immense importance to the APC government.",Politics & Power,https://thesun.ng/defectorll-strengthen-democracy-apc-nkire/,another development thrown weight behind opposition party members federal capital territory minister nyesom wike described patriot asset immense importance apc government
He said Wike is one of the most hard-working ministers Tinubu chose from the opposition parties on assumption of office.,Politics & Power,https://thesun.ng/defectorll-strengthen-democracy-apc-nkire/,said wike one hardworking ministers tinubu chose opposition parties assumption office
"According to him, “President Tinubu remains one of the best managers of men and material and knows how best to deploy politicians, irrespective of party affiliation.”",Politics & Power,https://thesun.ng/defectorll-strengthen-democracy-apc-nkire/,according president tinubu remains one best managers men material knows best deploy politicians irrespective party affiliation
"Aformer chairman of the Peoples Democratic Party (PDP) in Katsina State, Salisu Yusuf Majigiri, has formally joined the All Progressives Congress (APC).",Politics & Power,https://thesun.ng/ex-katsina-pdp-chairman-joins-apc/,aformer chairman peoples democratic party pdp katsina state salisu yusuf majigiri formally joined progressives congress apc
"Majigiri, currently representing Mashi/Dutsi Federal Constituency at the National Assembly, had earlier notified the leadership of the House of Representatives about his intention to leave the PDP for the APC.",Politics & Power,https://thesun.ng/ex-katsina-pdp-chairman-joins-apc/,majigiri currently representing mashidutsi federal constituency national assembly earlier notified leadership house representatives intention leave pdp apc
"Speaking during a ceremony at his ward in Mashi Local Government Area, where he formally registered as a member of the APC and collected his membership certificate, he said: “The PDP is suffering from a self-inflicted, protracted leadership illness.”",Politics & Power,https://thesun.ng/ex-katsina-pdp-chairman-joins-apc/,speaking ceremony ward mashi local government area formally registered member apc collected membership certificate said pdp suffering selfinflicted protracted leadership illness
He alleged that the PDP in Katsina State was enmeshed in irreconcilable differences and lacking coherent leadership orchestrated by some ‘self-fish individuals’ within the party.,Politics & Power,https://thesun.ng/ex-katsina-pdp-chairman-joins-apc/,alleged pdp katsina state enmeshed irreconcilable differences lacking coherent leadership orchestrated selffish individuals within party
"According to him, “PDP is suffering from protracted leadership illness both at national and state levels since after the 2023 presidential primary of the party. So, if there is no leadership, what can you do for your people?",Politics & Power,https://thesun.ng/ex-katsina-pdp-chairman-joins-apc/,according pdp suffering protracted leadership illness national state levels since 2023 presidential primary party leadership people
"“It’s important to put the interest of our people first, not our individual and personal interests. We need development, progress and better wellbeing of our people. So, it is better for me to join a party that is focused with direction and unity.",Politics & Power,https://thesun.ng/ex-katsina-pdp-chairman-joins-apc/,important put interest people first individual personal interests need development progress better wellbeing people better join party focused direction unity
"“The APC is not in court but look at our opposition parties, most of them are in court. So, to ensure better leadership for my people, it is better for me to join the APC so that I can give my contribution to the development of my constituency, Katsina State and Nigeria in general.”",Politics & Power,https://thesun.ng/ex-katsina-pdp-chairman-joins-apc/,apc court look opposition parties court ensure better leadership people better join apc give contribution development constituency katsina state nigeria general
"Also speaking at the ceremony, the Katsina State APC vice chairman, Bala Abu-Musawa, said that Majigiri had contributed enormously to the development and sustainability of the political landscape of the state.",Politics & Power,https://thesun.ng/ex-katsina-pdp-chairman-joins-apc/,also speaking ceremony katsina state apc vice chairman bala abumusawa said majigiri contributed enormously development sustainability political landscape state
…Inaugurates 1000 capacity council hall,Politics & Power,https://thesun.ng/okpebholo-ll-prioritise-security-workers-welfare-edo-dg-idahosa/,inaugurates 1000 capacity council hall
"The deputy governor of Edo State, Rt. Hon. Dennis Idahosa, yesterday, assured that the Governor Monday Okpebholo-led administration would prioritise the welfare of workers, including those at the local government areas as well as ensure security of lives and property in the state.",Politics & Power,https://thesun.ng/okpebholo-ll-prioritise-security-workers-welfare-edo-dg-idahosa/,deputy governor edo state rt hon dennis idahosa yesterday assured governor monday okpebhololed administration would prioritise welfare workers including local government areas well ensure security lives property state
"He gave the assurance in Okada, the administrative headquarters of Ovia North-East Local Government Area of the state, during the inauguration of a 1000 capacity hall, staff, and security vehicles procired by the Local Government Council.",Politics & Power,https://thesun.ng/okpebholo-ll-prioritise-security-workers-welfare-edo-dg-idahosa/,gave assurance okada administrative headquarters ovia northeast local government area state inauguration 1000 capacity hall staff security vehicles procired local government council
"Idahosa commended the quality of leadership being provided by the Council chairman, Hon. Igbinake Omoruyi, noting that executing quality projects within four months in office showed that the council boss was committed to providing good governance in the local government.",Politics & Power,https://thesun.ng/okpebholo-ll-prioritise-security-workers-welfare-edo-dg-idahosa/,idahosa commended quality leadership provided council chairman hon igbinake omoruyi noting executing quality projects within four months office showed council boss committed providing good governance local government
“We knew the kind of person we were giving leadership to in Ovia North-East as well as knowing he was going to work in line with the vision of this administration.,Politics & Power,https://thesun.ng/okpebholo-ll-prioritise-security-workers-welfare-edo-dg-idahosa/,knew kind person giving leadership ovia northeast well knowing going work line vision administration
"“We were certain he was going to give good leadership. We are seeing the dividends of democracy in Ovia North-East,” the deputy governor stated, adding that Omoruyi did not only make him proud, but had also not failed his people as the son of the soil.",Politics & Power,https://thesun.ng/okpebholo-ll-prioritise-security-workers-welfare-edo-dg-idahosa/,certain going give good leadership seeing dividends democracy ovia northeast deputy governor stated adding omoruyi make proud also failed people son soil
He said the council hall would be beneficial to the council workers’ welfare just like the staff bus while the security vehicles would further boost security in the area,Politics & Power,https://thesun.ng/okpebholo-ll-prioritise-security-workers-welfare-edo-dg-idahosa/,said council hall would beneficial council workers welfare like staff bus security vehicles would boost security area
"In his address, the Chairman of the Council, Omoruyi, commended Okpebholo for giving him the free hand to carry out his official duties, which has culminated in the inauguration of these projects.",Politics & Power,https://thesun.ng/okpebholo-ll-prioritise-security-workers-welfare-edo-dg-idahosa/,address chairman council omoruyi commended okpebholo giving free hand carry official duties culminated inauguration projects
"On his part, Comrade Igbinoba Omoregbe Chairman, Nigerian Union of Local Government Employees (NULGE), also praised Governor Okpebholo and his deputy for providing the conducive atmosphere that was already yielding dividends of democracy for the people.",Politics & Power,https://thesun.ng/okpebholo-ll-prioritise-security-workers-welfare-edo-dg-idahosa/,part comrade igbinoba omoregbe chairman nigerian union local government employees nulge also praised governor okpebholo deputy providing conducive atmosphere already yielding dividends democracy people
"Former Anambra State Governor Peter Obi has said he has no issues with President Bola Tinubu, adding that his fight is against bad governance.",Politics & Power,https://thesun.ng/my-fight-isnt-with-tinubu-im-fighting-bad-governance-obi/,former anambra state governor peter obi said issues president bola tinubu adding fight bad governance
"Obi, who spoke during a public engagement following his return to the country after he visited the Vatican, added that his fight is against hunger, poverty, out-of-school children, and lack of access to health services.",Politics & Power,https://thesun.ng/my-fight-isnt-with-tinubu-im-fighting-bad-governance-obi/,obi spoke public engagement following return country visited vatican added fight hunger poverty outofschool children lack access health services
"In his response to reactions over a picture taken with Tinubu in Rome, Obi stated, “I and the president are not fighting. I’m not fighting anybody.",Politics & Power,https://thesun.ng/my-fight-isnt-with-tinubu-im-fighting-bad-governance-obi/,response reactions picture taken tinubu rome obi stated president fighting im fighting anybody
"“My fight is against bad governance, against hunger, against poverty, against out-of-school children, against people not having health services.",Politics & Power,https://thesun.ng/my-fight-isnt-with-tinubu-im-fighting-bad-governance-obi/,fight bad governance hunger poverty outofschool children people health services
"“This country has less than 10 per cent health insurance. It should be 100 per cent,” Obi said.",Politics & Power,https://thesun.ng/my-fight-isnt-with-tinubu-im-fighting-bad-governance-obi/,country less 10 per cent health insurance 100 per cent obi said
"Broaching the subject of education, he noted that the payment of teachers is the responsibility of the government, in accordance with the Universal Basic Education policy.",Politics & Power,https://thesun.ng/my-fight-isnt-with-tinubu-im-fighting-bad-governance-obi/,broaching subject education noted payment teachers responsibility government accordance universal basic education policy
“These teachers teaching here should be paid by the government because it’s universal basic education.,Politics & Power,https://thesun.ng/my-fight-isnt-with-tinubu-im-fighting-bad-governance-obi/,teachers teaching paid government universal basic education
“The law says here that our children should go to school free. So what my Lord is doing is helping the government. The government should help him.”,Politics & Power,https://thesun.ng/my-fight-isnt-with-tinubu-im-fighting-bad-governance-obi/,law says children go school free lord helping government government help
"A former chairman of the People’s Democratic Party (PDP) in Katsina State, Hon. Salisu Yusuf Majigiri, has formally joined the All Progressives Congress (APC).",Politics & Power,https://thesun.ng/ex-katsina-pdp-chairman-formally-joins-apc-picks-membership-card/,former chairman peoples democratic party pdp katsina state hon salisu yusuf majigiri formally joined progressives congress apc
"Majigiri, currently representing Mashi/Dutsi Federal Constituency at the National Assembly had earlier notified the leadership of the House of Representatives of his intention to quit the PDP for the APC.",Politics & Power,https://thesun.ng/ex-katsina-pdp-chairman-formally-joins-apc-picks-membership-card/,majigiri currently representing mashidutsi federal constituency national assembly earlier notified leadership house representatives intention quit pdp apc
"Speaking at a ceremony at his Majigiri ward of Mashi Local Government Area where he formally registered as a member of the APC and collected his membership certificate, Majigiri said that, “the PDP is suffering from a self-inflicted protracted leadership illness.”",Politics & Power,https://thesun.ng/ex-katsina-pdp-chairman-formally-joins-apc-picks-membership-card/,speaking ceremony majigiri ward mashi local government area formally registered member apc collected membership certificate majigiri said pdp suffering selfinflicted protracted leadership illness
"Moreover, he alleged that the PDP in Katsina State is enmeshed in “irreconcilable differences” and lacking coherent leadership orchestrated by some “self-fish individuals” within the party.",Politics & Power,https://thesun.ng/ex-katsina-pdp-chairman-formally-joins-apc-picks-membership-card/,moreover alleged pdp katsina state enmeshed irreconcilable differences lacking coherent leadership orchestrated selffish individuals within party
"According to him, “PDP is suffering from protracted leadership illness both at national and state levels since after the 2023 presidential primary of the party. So, if there is no leadership, what can you do for your people?",Politics & Power,https://thesun.ng/ex-katsina-pdp-chairman-formally-joins-apc-picks-membership-card/,according pdp suffering protracted leadership illness national state levels since 2023 presidential primary party leadership people
"“It’s important to put the interest of our people first, not our individual and personal interests. “We need development, progress and better wellbeing of our people. So, it is better for me to join a party that is focused with direction and united.",Politics & Power,https://thesun.ng/ex-katsina-pdp-chairman-formally-joins-apc-picks-membership-card/,important put interest people first individual personal interests need development progress better wellbeing people better join party focused direction united
"“The APC is not in court but look at our opposition parties, most of them are in court. So, to ensure better leadership for my people, it is better for me to join the APC so that I can give my contribution to the development of my constituency, Katsina state and Nigeria in general.”",Politics & Power,https://thesun.ng/ex-katsina-pdp-chairman-formally-joins-apc-picks-membership-card/,apc court look opposition parties court ensure better leadership people better join apc give contribution development constituency katsina state nigeria general
"Also speaking at the ceremony, the Katsina State APC Vice Chairman, Bala Abu-Musawa, said that Majigiri had contributed enormously to the development and sustainability of the political landscape of the state.",Politics & Power,https://thesun.ng/ex-katsina-pdp-chairman-formally-joins-apc-picks-membership-card/,also speaking ceremony katsina state apc vice chairman bala abumusawa said majigiri contributed enormously development sustainability political landscape state
"The National Coordinator of Disciples of Jagaban (DOJ), a 2023 supporter group, Comrade Abdulhakeem Adegoke Alawuje has described those politicians forming coalitions with the intent to unseat President Bola Tinubu in the 2027 election as political amateurs.",Politics & Power,https://thesun.ng/coalitions-only-tinubu-knows-the-road-to-2027-elections-alawuje-doj/,national coordinator disciples jagaban doj 2023 supporter group comrade abdulhakeem adegoke alawuje described politicians forming coalitions intent unseat president bola tinubu 2027 election political amateurs
"Alawuje said as long as preparation for the 2027 presidential election is concerned, only President Tinubu knows the way to the destination, stressing that many will miss the road and crash.",Politics & Power,https://thesun.ng/coalitions-only-tinubu-knows-the-road-to-2027-elections-alawuje-doj/,alawuje said long preparation 2027 presidential election concerned president tinubu knows way destination stressing many miss road crash
The DOJ Coordinator spoke at a function on 2027 general elections organised in Zaria by the supporters of Tinubu.,Politics & Power,https://thesun.ng/coalitions-only-tinubu-knows-the-road-to-2027-elections-alawuje-doj/,doj coordinator spoke function 2027 general elections organised zaria supporters tinubu
"“Today, we witness a theatre of confusion. A group of political amateurs—yes, learners—now parade themselves as alternatives to tested leadership. They are forming coalitions in haste, not in purpose. They hold the steering wheel of political ambition, but they do not yet know the road.",Politics & Power,https://thesun.ng/coalitions-only-tinubu-knows-the-road-to-2027-elections-alawuje-doj/,today witness theatre confusion group political amateursyes learnersnow parade alternatives tested leadership forming coalitions haste purpose hold steering wheel political ambition yet know road
"“Let me be blunt: by 2027, these learners will crash into the realities of political depth and strategy. Because politics, my friends, is not about noise—it is about knowing the terrain, understanding the people, and building enduring legacies.",Politics & Power,https://thesun.ng/coalitions-only-tinubu-knows-the-road-to-2027-elections-alawuje-doj/,let blunt 2027 learners crash realities political depth strategy politics friends noiseit knowing terrain understanding people building enduring legacies
"“To those shouting about coalitions, I say this—understand that a coalition without ideology is like a ship without a compass. It will drift, and eventually sink. A coalition formed on desperation and ambition cannot stand against a legacy built on vision and sacrifice.",Politics & Power,https://thesun.ng/coalitions-only-tinubu-knows-the-road-to-2027-elections-alawuje-doj/,shouting coalitions say thisunderstand coalition without ideology like ship without compass drift eventually sink coalition formed desperation ambition cannot stand legacy built vision sacrifice
