text,category,source,cleaned_text
"This is because the incumbent deputy governor, Dr. Hadiza Balarabe, would have served two terms to exit office constitutionally by 2027.",Politics & Power,https://thesun.ng/kaduna-2027-scramble-for-deputy-governorship-seat-hots-up-as-groups-mount-pressure-on-gov-sani/,incumbent deputy governor dr hadiza balarabe would served two terms exit office constitutionally 2027
"Surprisingly, Southern Kaduna people, unlike in the past when they strongly fixed their eyes on the number one seat in the state, now appeared to be more interested in the number two seat.",Politics & Power,https://thesun.ng/kaduna-2027-scramble-for-deputy-governorship-seat-hots-up-as-groups-mount-pressure-on-gov-sani/,surprisingly southern kaduna people unlike past strongly fixed eyes number one seat state appeared interested number two seat
"The recent mass defection to the ruling All Progressive Congress (APC) from the major opposition party, People’s Democratic Party (PDP) may have no doubt given Governor Uba Sani soft landing for the second tenure in office, come 2027.",Politics & Power,https://thesun.ng/kaduna-2027-scramble-for-deputy-governorship-seat-hots-up-as-groups-mount-pressure-on-gov-sani/,recent mass defection ruling progressive congress apc major opposition party peoples democratic party pdp may doubt given governor uba sani soft landing second tenure office come 2027
"However, the people will do everything humanly possible to have the position of deputy governor given to them, Christian community in particular, even as Muslim community too vows not give up the position.",Politics & Power,https://thesun.ng/kaduna-2027-scramble-for-deputy-governorship-seat-hots-up-as-groups-mount-pressure-on-gov-sani/,however people everything humanly possible position deputy governor given christian community particular even muslim community vows give position
"But the National President of Southern Kaduna people’s Union (SOKAPU), Samuel Tabara apparently showed no worry and concern about who becomes the deputy governor of the state between Muslim and Christian groups.",Politics & Power,https://thesun.ng/kaduna-2027-scramble-for-deputy-governorship-seat-hots-up-as-groups-mount-pressure-on-gov-sani/,national president southern kaduna peoples union sokapu samuel tabara apparently showed worry concern becomes deputy governor state muslim christian groups
"Tabara simply told Daily Sun that, “we need responsible people in government. Religion is not a barrier”.",Politics & Power,https://thesun.ng/kaduna-2027-scramble-for-deputy-governorship-seat-hots-up-as-groups-mount-pressure-on-gov-sani/,tabara simply told daily sun need responsible people government religion barrier
"SOKAPU’s position not withstanding, it was gathered that interest groups have emerged, holding nocturnal meetings in order to mount pressure on Governor Sani to pick his deputy from any of the groups that has the upper hand in convincing him.",Politics & Power,https://thesun.ng/kaduna-2027-scramble-for-deputy-governorship-seat-hots-up-as-groups-mount-pressure-on-gov-sani/,sokapus position withstanding gathered interest groups emerged holding nocturnal meetings order mount pressure governor sani pick deputy groups upper hand convincing
A dependable source privy to two of the separate meetings held recently by Islamic and Christian faith groups told Daily Sun that each group is hell bent on having the deputy governorship position to its side.,Politics & Power,https://thesun.ng/kaduna-2027-scramble-for-deputy-governorship-seat-hots-up-as-groups-mount-pressure-on-gov-sani/,dependable source privy two separate meetings held recently islamic christian faith groups told daily sun group hell bent deputy governorship position side
"The source added that while the Islamic group insisted that there is nothing wrong with retaining the Muslim-Muslim ticket since it is the political rights of the governor to select whoever he so wished to work with irrespective of ethno-religious inclination, the Christian group said there is no equity and balance in the administration of Kaduna State since religion has roles to play in political affairs of the state, and as such there should be fair sharing of political positions among the two major religions.",Politics & Power,https://thesun.ng/kaduna-2027-scramble-for-deputy-governorship-seat-hots-up-as-groups-mount-pressure-on-gov-sani/,source added islamic group insisted nothing wrong retaining muslimmuslim ticket since political rights governor select whoever wished work irrespective ethnoreligious inclination christian group said equity balance administration kaduna state since religion roles play political affairs state fair sharing political positions among two major religions
"It would be recalled that the immediate past governor of the state, Mallam Nasir El-Rufai had announced the selection of Hadiza Balarabe, a fellow Muslim as his running mate for the 2019 election, a decision that attracted wide spread criticism against the choice of the governor.",Politics & Power,https://thesun.ng/kaduna-2027-scramble-for-deputy-governorship-seat-hots-up-as-groups-mount-pressure-on-gov-sani/,would recalled immediate past governor state mallam nasir elrufai announced selection hadiza balarabe fellow muslim running mate 2019 election decision attracted wide spread criticism choice governor
"At that time El-Rufai said the choice of Mrs Hadiza was deliberately done to encourage women participation in government, adding that the then President Muhammadu Buhari endorsed the choice of Hadiza.",Politics & Power,https://thesun.ng/kaduna-2027-scramble-for-deputy-governorship-seat-hots-up-as-groups-mount-pressure-on-gov-sani/,time elrufai said choice mrs hadiza deliberately done encourage women participation government adding president muhammadu buhari endorsed choice hadiza
"A source disclosed that while El-Rufai was shopping for a deputy governor, names of one Shaddalafiya, and one Ruth of Christian extraction in Southern Kaduna came up, but El-Rufai rejected them on the excuse that he couldn’t dump Buhari’s choice.",Politics & Power,https://thesun.ng/kaduna-2027-scramble-for-deputy-governorship-seat-hots-up-as-groups-mount-pressure-on-gov-sani/,source disclosed elrufai shopping deputy governor names one shaddalafiya one ruth christian extraction southern kaduna came elrufai rejected excuse couldnt dump buharis choice
"The then incumbent deputy governor, Barnabas Bala, had opted to go to the National Assembly having emerged as the APC’s candidate for the Southern Kaduna Senatorial district. But Bala died few months after he lost the election for the National Assembly seat.",Politics & Power,https://thesun.ng/kaduna-2027-scramble-for-deputy-governorship-seat-hots-up-as-groups-mount-pressure-on-gov-sani/,incumbent deputy governor barnabas bala opted go national assembly emerged apcs candidate southern kaduna senatorial district bala died months lost election national assembly seat
"Nevertheless, the selection of Hadiza Balarabe was the first time in the history of Kaduna State that a major political party will select a woman as running mate.",Politics & Power,https://thesun.ng/kaduna-2027-scramble-for-deputy-governorship-seat-hots-up-as-groups-mount-pressure-on-gov-sani/,nevertheless selection hadiza balarabe first time history kaduna state major political party select woman running mate
"Prior to becoming the deputy governor, Balarabe was the Executive Secretary of the Kaduna State Primary Health Care Development Agency, a position she had held since February 2016.",Politics & Power,https://thesun.ng/kaduna-2027-scramble-for-deputy-governorship-seat-hots-up-as-groups-mount-pressure-on-gov-sani/,prior becoming deputy governor balarabe executive secretary kaduna state primary health care development agency position held since february 2016
In that role she had overseen the Kaduna State Government’s programme to revitalise and strengthen primary health care as the core of health service delivery in the state.,Politics & Power,https://thesun.ng/kaduna-2027-scramble-for-deputy-governorship-seat-hots-up-as-groups-mount-pressure-on-gov-sani/,role overseen kaduna state governments programme revitalise strengthen primary health care core health service delivery state
"Under her watch, the State renovated and equipped 255 primary health centres with tools to assist better antenatal services and safer delivery. The agency also helped expanded vaccine coverage to protect children across the state.",Politics & Power,https://thesun.ng/kaduna-2027-scramble-for-deputy-governorship-seat-hots-up-as-groups-mount-pressure-on-gov-sani/,watch state renovated equipped 255 primary health centres tools assist better antenatal services safer delivery agency also helped expanded vaccine coverage protect children across state
"Also, before joining the service of Kaduna State, Hadiza Balarabe was the Director of Public Health in the Federal Capital Territory (FCT). She studied Medicine at the University of Maiduguri, and graduated in 1988. She was a Senior Registrar at the Ahmadu Bello University Teaching Hospital (ABUTH) before joining the services of the FCT in 2004.",Politics & Power,https://thesun.ng/kaduna-2027-scramble-for-deputy-governorship-seat-hots-up-as-groups-mount-pressure-on-gov-sani/,also joining service kaduna state hadiza balarabe director public health federal capital territory fct studied medicine university maiduguri graduated 1988 senior registrar ahmadu bello university teaching hospital abuth joining services fct 2004
"In 2019, El-Rufai supported Uba Sani to replace Shehu Sani as the Senator for the Kaduna Central Senatorial DMistrict, before also supporting Uba Sani in succeeding him as governor in 2023.",Politics & Power,https://thesun.ng/kaduna-2027-scramble-for-deputy-governorship-seat-hots-up-as-groups-mount-pressure-on-gov-sani/,2019 elrufai supported uba sani replace shehu sani senator kaduna central senatorial dmistrict also supporting uba sani succeeding governor 2023
Governor Sani was Mr El-Rufai’s political adviser when the latter served his first term as governor between 2015 and 2019.,Politics & Power,https://thesun.ng/kaduna-2027-scramble-for-deputy-governorship-seat-hots-up-as-groups-mount-pressure-on-gov-sani/,governor sani mr elrufais political adviser latter served first term governor 2015 2019
"Meanwhile, some religious clerics have reacted to the issue of Muslim-Muslim ticket for the Kaduna State governorship election in 2027.",Politics & Power,https://thesun.ng/kaduna-2027-scramble-for-deputy-governorship-seat-hots-up-as-groups-mount-pressure-on-gov-sani/,meanwhile religious clerics reacted issue muslimmuslim ticket kaduna state governorship election 2027
"A Kaduna based Pastor, Rev. Emmanuel Olorunmagba said, “as fate will have it for Kaduna State Governor, Senator Uba Sani, his Deputy will complete her two tenures by 2027. She did one term with former Governor El-Rufai and has done the second term with Uba Sani. Hence, she will no longer be able to contest as Deputy Governor based on the law.",Politics & Power,https://thesun.ng/kaduna-2027-scramble-for-deputy-governorship-seat-hots-up-as-groups-mount-pressure-on-gov-sani/,kaduna based pastor rev emmanuel olorunmagba said fate kaduna state governor senator uba sani deputy complete two tenures 2027 one term former governor elrufai done second term uba sani hence longer able contest deputy governor based law
"“Therefore, the situation has created opportunity for Senator Uba Sani of Kaduna State to prove that he is truly ready to undo the errors of his predecessor. And one of these major errors that needed to be corrected is this Muslim-Muslim ticket. Hence, we hope that Governor Uba Sani will do the needful by getting a Christian from Southern Kaduna as his next running mate”.",Politics & Power,https://thesun.ng/kaduna-2027-scramble-for-deputy-governorship-seat-hots-up-as-groups-mount-pressure-on-gov-sani/,therefore situation created opportunity senator uba sani kaduna state prove truly ready undo errors predecessor one major errors needed corrected muslimmuslim ticket hence hope governor uba sani needful getting christian southern kaduna next running mate
"In his own reaction, the Secretary of the Kaduna State chapter of Supreme Council for Shari’ah in Nigeria (SCSN), Alhaji AbdurRahman Hassan, noted that, “first of all democracy is a game of number, this is what is at play in Kaduna State. When former Governor Nasir Ahmad El-Rufai went for the Muslim-Muslim ticket, most of our Christian brothers in the state, more especially in Southern Kaduna did not vote for him. Yet he won without their votes.",Politics & Power,https://thesun.ng/kaduna-2027-scramble-for-deputy-governorship-seat-hots-up-as-groups-mount-pressure-on-gov-sani/,reaction secretary kaduna state chapter supreme council shariah nigeria scsn alhaji abdurrahman hassan noted first democracy game number play kaduna state former governor nasir ahmad elrufai went muslimmuslim ticket christian brothers state especially southern kaduna vote yet without votes
"“The stand of our Council, Supreme Council for Shariah in Nigeria (SCSN) Kaduna State Chapter), is: we will never go for anything contrary. After all, the population of Muslims in Plateau State is by far greater than Christian population in Kaduna State, yet there wasn’t any Muslim Deputy Governor in Plateau State right from the beginning of second republic.",Politics & Power,https://thesun.ng/kaduna-2027-scramble-for-deputy-governorship-seat-hots-up-as-groups-mount-pressure-on-gov-sani/,stand council supreme council shariah nigeria scsn kaduna state chapter never go anything contrary population muslims plateau state far greater christian population kaduna state yet wasnt muslim deputy governor plateau state right beginning second republic
"“No one is crying foul, why should there be any complain in Kaduna State, if Muslim-Muslim ticket is maintained? So, the politicians have the right to make their choices, but they shouldn’t forget that the electorate also have their rights.”",Politics & Power,https://thesun.ng/kaduna-2027-scramble-for-deputy-governorship-seat-hots-up-as-groups-mount-pressure-on-gov-sani/,one crying foul complain kaduna state muslimmuslim ticket maintained politicians right make choices shouldnt forget electorate also rights
"Interestingly, political observers have noted that Governor Uba Sani appear to have a soft spot for a Christian Deputy Governor, come 2027. This, according to one of the political observers who pleaded anonymity is the fact that the governor will like to have a Christian deputy governor to penetrate the Christian community better as part of the state’s efforts to achieve peaceful coexistence between the two major religions.",Politics & Power,https://thesun.ng/kaduna-2027-scramble-for-deputy-governorship-seat-hots-up-as-groups-mount-pressure-on-gov-sani/,interestingly political observers noted governor uba sani appear soft spot christian deputy governor come 2027 according one political observers pleaded anonymity fact governor like christian deputy governor penetrate christian community better part states efforts achieve peaceful coexistence two major religions
“You can see Governor Uba Sani’s actions and body language towards Christians in the state is friendly. He is very close to them physically and spiritually. He personally attended Christmas carol on two occasions in the state. This is what his deputy should have done if she is a Christian so that the governor himself could attend to other state issues.,Politics & Power,https://thesun.ng/kaduna-2027-scramble-for-deputy-governorship-seat-hots-up-as-groups-mount-pressure-on-gov-sani/,see governor uba sanis actions body language towards christians state friendly close physically spiritually personally attended christmas carol two occasions state deputy done christian governor could attend state issues
"“Governor Uba Sani has been advising well-meaning residents of Kaduna State to checkmate the antics of ethnic and religious bigots, by living in peace, love and unity for overall progress and development of the state,” the source said.",Politics & Power,https://thesun.ng/kaduna-2027-scramble-for-deputy-governorship-seat-hots-up-as-groups-mount-pressure-on-gov-sani/,governor uba sani advising wellmeaning residents kaduna state checkmate antics ethnic religious bigots living peace love unity overall progress development state source said
"Daily Sun recalls that during the 2023 and 2024 Christmas festivities, Governor Uba Sani had attended the Christmas Carol of Six Lessons organised by the Kaduna State chapter of the Christian Association of Nigeria (CAN) at ECWA Good News, Narayi High Cost, Kaduna.",Politics & Power,https://thesun.ng/kaduna-2027-scramble-for-deputy-governorship-seat-hots-up-as-groups-mount-pressure-on-gov-sani/,daily sun recalls 2023 2024 christmas festivities governor uba sani attended christmas carol six lessons organised kaduna state chapter christian association nigeria ecwa good news narayi high cost kaduna
"This style of leadership, according to political observers, had never happened with a Muslim governor in the history of Kaduna, except by delegating their Christian deputy governors to represent them at such occasions.",Politics & Power,https://thesun.ng/kaduna-2027-scramble-for-deputy-governorship-seat-hots-up-as-groups-mount-pressure-on-gov-sani/,style leadership according political observers never happened muslim governor history kaduna except delegating christian deputy governors represent occasions
"Governor Sani who noted that there could be no development without peace and harmony, expressed happiness that everyone now lives freely without intimidation because of their tribal or religious affiliations in Kaduna State.",Politics & Power,https://thesun.ng/kaduna-2027-scramble-for-deputy-governorship-seat-hots-up-as-groups-mount-pressure-on-gov-sani/,governor sani noted could development without peace harmony expressed happiness everyone lives freely without intimidation tribal religious affiliations kaduna state
"According to the governor, he attended the Christmas Carol to celebrate with Christians because when he took the oath of office, he promised to treat everyone equally, irrespective of their religious, tribal, or political affiliations.",Politics & Power,https://thesun.ng/kaduna-2027-scramble-for-deputy-governorship-seat-hots-up-as-groups-mount-pressure-on-gov-sani/,according governor attended christmas carol celebrate christians took oath office promised treat everyone equally irrespective religious tribal political affiliations
"He expressed happiness that both Jama’atuI Nasril Islam (JNI) and CAN have been working together as one family to maintain peace in Kaduna State, which he described as an important achievement.",Politics & Power,https://thesun.ng/kaduna-2027-scramble-for-deputy-governorship-seat-hots-up-as-groups-mount-pressure-on-gov-sani/,expressed happiness jamaatui nasril islam jni working together one family maintain peace kaduna state described important achievement
"The governor commended the Secretary of Jama’atu Nasril Islam (JNI) who attended the Christmas Carol with him, adding that “I can tell you that some people are not happy, but the fact remains that we took an oath, and those who are not happy may be the minority. The most important thing is that the majority are happy because we are working towards the development and progress of our state; for me, that is the key.”",Politics & Power,https://thesun.ng/kaduna-2027-scramble-for-deputy-governorship-seat-hots-up-as-groups-mount-pressure-on-gov-sani/,governor commended secretary jamaatu nasril islam jni attended christmas carol adding tell people happy fact remains took oath happy may minority important thing majority happy working towards development progress state key
"Tothose who do not understand the nitty-gritty of the undercurrents of President Bola Tinubu’s forging of alliances across regional cleavages and political spectrums ahead of the 2027 presidential election, his recent visit to Anambra State was a mere trip to ceremoniously inaugurate projects executed by the Governor, Professor Chukwuma Charles Soludo.",Politics & Power,https://thesun.ng/ndigbo-tinubus-anambra-visit-and-2027/,tothose understand nittygritty undercurrents president bola tinubus forging alliances across regional cleavages political spectrums ahead 2027 presidential election recent visit anambra state mere trip ceremoniously inaugurate projects executed governor professor chukwuma charles soludo
"But it was not. The visit was more than projects commissioning. Observers insist that ingrained in the visit was a pragmatic building of alliances, fellowship and support base ahead of the next round of elections.",Politics & Power,https://thesun.ng/ndigbo-tinubus-anambra-visit-and-2027/,visit projects commissioning observers insist ingrained visit pragmatic building alliances fellowship support base ahead next round elections
"Apparently determined to prevent in 2027 a repeat of the 2023 disastrous performance of his party, the All Progressives Congress (APC), in the South-East, the President, observers say, appears to have started in earnest to build bridges of friendship in the region, smoothening rough edges and marketing the imperativeness of his re-election to Ndigbo (Igbo race), using Anambra as a springboard.",Politics & Power,https://thesun.ng/ndigbo-tinubus-anambra-visit-and-2027/,apparently determined prevent 2027 repeat 2023 disastrous performance party progressives congress apc southeast president observers say appears started earnest build bridges friendship region smoothening rough edges marketing imperativeness reelection ndigbo igbo race using anambra springboard
"Watchers of South-East politics posit that President Tinubu aims for a mutually beneficial alliance and fraternity with the region, a sort of, to use a common Nigerian parlance, “I scratch your back, your scratch my back” kind of relationship that guarantees a win-win situation. In essence, President Tinubu is expected to attend to myriads of economic and infrastructural needs of Ndigbo while they in turn reciprocate with their votes in 2027.",Politics & Power,https://thesun.ng/ndigbo-tinubus-anambra-visit-and-2027/,watchers southeast politics posit president tinubu aims mutually beneficial alliance fraternity region sort use common nigerian parlance scratch back scratch back kind relationship guarantees winwin situation essence president tinubu expected attend myriads economic infrastructural needs ndigbo turn reciprocate votes 2027
"This, according to pundits is expected to solidify the president’s chances for overwhelming victory in the region in the next election.",Politics & Power,https://thesun.ng/ndigbo-tinubus-anambra-visit-and-2027/,according pundits expected solidify presidents chances overwhelming victory region next election
"Instructively, upon touching down at the Chinua Achebe Airport, Umueri, President Tinubu was enthusiastically received by Governor Soludo and the people of the state. The trademark hospitality of Ndigbo was handy as Anambra Traditional Rulers led by the Chairman of the State Traditional Rulers Council, Igwe Chidubem Iweka of Obosi, conferred on the President, the title of “Dike Si Mba’, which loosely translates to ‘Hero from another land’",Politics & Power,https://thesun.ng/ndigbo-tinubus-anambra-visit-and-2027/,instructively upon touching chinua achebe airport umueri president tinubu enthusiastically received governor soludo people state trademark hospitality ndigbo handy anambra traditional rulers led chairman state traditional rulers council igwe chidubem iweka obosi conferred president title dike si mba loosely translates hero another land
"And in rare display of a pragmatism and paradigm shift in party politics, the president not only lauded Soludo’s performance in office but tacitly endorsed his re-election, despite the APC having a candidate in the person of a multi-billionaire businessman, Prince Nicholas Ukachukwu, for the November Anambra governorship election.",Politics & Power,https://thesun.ng/ndigbo-tinubus-anambra-visit-and-2027/,rare display pragmatism paradigm shift party politics president lauded soludos performance office tacitly endorsed reelection despite apc candidate person multibillionaire businessman prince nicholas ukachukwu november anambra governorship election
"“Your son, Soludo is my very good friend. He remains my friend and we will keep working together”, the President had told Ndi Anambra during a Town Hall meeting featuring prominent indigenes of the state, including former Commonwealth Secretary-General, Chief Emeka Anyaoku in whose honour he had earlier commissioned a building project at the Nnamdi Azikiwe University, Awka, housing the Emeka Anyaoku Institute for International Studies and Diplomacy.",Politics & Power,https://thesun.ng/ndigbo-tinubus-anambra-visit-and-2027/,son soludo good friend remains friend keep working together president told ndi anambra town hall meeting featuring prominent indigenes state including former commonwealth secretarygeneral chief emeka anyaoku whose honour earlier commissioned building project nnamdi azikiwe university awka housing emeka anyaoku institute international studies diplomacy
